title,view,like,unlike,comment,date,comment_text
하복부 운동 제대로 하는 꿀팁 아랫뱃살 빼는 운동은 이렇게해야돼요 (레그레이즈 허리통증잡기),7656948,84000,2400,1911,2019.1.21,이거 보면서 이불속에 누어있는 내 인생 위 뱃살 위 허벅지 안쪽살 위 겨드랑이살 위 턱살 어려우니 여기부터 허벅지 안쪽살이요 정말운동을 해서 빼더라고 잘 안빠지고 다리 모양도 못생겨서 스트레스 받고 허벅지 안쪽살들이 헤어졌으면 좋겠어요 썸네일에 배가 제 배랑 똑같아서 들어와습니다 열심히 운동 따라하겠습니다 
유산소 다이어트 진실 러닝머신을 해야만 체지방이 빠진다 러닝머신 없이 체지방 빼는 방법,3227445,36000,1300,2152,2018.4.4,즉 살빠지려면 숨넘어가기 직전까지 해야 빠진다는 말씀 운동 깨짝 살짝힘들정도로 하고 스스로 만족하면 절대 안빠진다는거 근데 웃긴게 처음에 뒤질꺼같다가 자꾸하다보면 체력이나 근력이 늘어나는게 느껴져서 그 맛을 본 사람들은 운동을 꾸준히 함 어후 버피는 어떻게든 피해갈수 없구나 유산소 무산소가 중요한게 아니라 짧은 시간동안이라도 숨이 헐떡일정도의 고강도운동을 해야함 그래야 혈액속에 있는 당이 소모되고 지방축적을 막을수 있음 런닝머신으로 살빼려면 고강도 런닝타면 충분히 빠지긴함 진짜 식단이 최고임 치킨 한마리먹으면 그냥 지구뛰셈 까알끔한 결론 
진짜살빠질때 오는 신호 (가짜살빠짐주의)/제이제이살롱드핏,2722071,35000,474,2001,2019.9.4,허벅지 사이에 틈이 생기기시작하면 그때 사이즈가 줄었구나 하고 느껴요 여러분 웨이트는 진짜 꼭 하셔야해요 몸매예뻐지는건 둘째 문제이고 삶이 편해져요 진짜로 근육이 생기니까 일을해도 편하고 어지러움도 사라지고 정말 좋아요 그러다보면 몸매는 따라오구요 남이 찍어준 사진에 만족할 때 진짜 돼진가봐 저 근육이랑 지방 사진이 고구마로 보여 와피곤한 이유가 제대로 다이어트한다는 의미이기도 하다니 
전설의 운동 하체토닝 하루만에 허벅지안쪽 아랫배 골반라인을 다잡아,2638196,66000,551,1183,2020.2.28,진짜 마일리사이러스 운동 그런것마냥 초 세주고 하는것처럼 만들어 주시면 안돼요 진짜 그러면 저 열심히 할 자신 난 왜 이걸 누워서 보는가 스쿼트 홀딩스쿼트 초씩 회 와이드 홀딩스쿼트 초씩 회 하프 스쿼트 총 회 세트 런지 회 세트 버피 회 세트 루틴 총정리 이거 할때마다 갓 태어난 아기염소체험 무료로 쌉가능 후들후들거림 일어나는 게 이렇게 힘들구나 싶더군요 흡 이거 운동 가이드처럼 처음부터 끝까지 띠라할 수 있게 만들면 복부부터 하체살 빼고 싶어하는 분들이 좋아해서 영상이 잘 팔릴 거 깉아요 쌤 
앞벅지 NO 힙스쿼트 하는 방법 (엉덩이 쓰는 스쿼트 힙업운동) hip squat,2430938,33000,1100,772,2018.11.9,진짜 말많다고 욕하는 사람들 이해할 수가 없네 스쿼트가 처음 하는 사람들이 자세만 보여주면 따라할 수 있는 동작인줄 아나 전반적인 이해를 도와주려고 풀어 설명해줘도 뭐라하네 빠르게 자세만 확인하고 싶으면 스쿼트 쳐서 다른 동영상 보세요 여기 와서 말많다고 욕하지 말고 분초 짜리 영상도 성질 급해서 못 버티는데 살이 빠지겠냐 운동은 진짜 신기한게 내가 어느부위에 집중하고 어느부위중심으로 힘주냐에 따라 같은동작도 다른운동이 되는거 같음 이래서 영상만보고 따라하면 안되고 설명을 들으면서 해야됨  언니 어깨라인 진짜 대박이세요대핵 부러움 
겨드랑이 살 빼기 부유방없애기운동  JJ다이어트 인벤  Get rid of armpit fat,2351849,38000,1600,786,2017.7.13,있는게 귀엽다는니 빼지 말라느니 지랄들 났네보여주려고 빼는게 아니고 자기만족이란다 운동 전 근육 위치등 설명이 있어야 운동 시 자극이 잘 느껴져요 서론 길다고 뭐라 뭐라 하는분들은 장담컨대 제대로 느낌 못 잡으실거에요 유튜브 영상 말고 오프라인에서 혹은 온라인 보세요 설명이 더 깁니다 그만큼 중요한건데 자꾸 테클걸어 제이제이님이 설명 생략하실까봐 짜증나네요 와 진짜 이거 알려주는분 처음봤어요 감사해요 부유방제거 운동 벤트니 푸쉬업 회세트 양손 위치 중요 넓게 벌리기 팔꿈치 꺽지 바깥쪽으로 등 구부리지 않고 가슴 활짝 피기 몸 일자 시선 정면 체스트 플랭크 초씩 회세트 다리 넓게 벌린 기본 플랭크 자세 손 가슴 옆에 짚기 팔 지면과 수직 팔 직각 어깨높이 평행 시선 바닥 부유방이 심해서 고민이었는데 이영상 발견하구 월부터 집에서 홈트레이닝 하면서 이동작을 매일매일 꾸준히 해줬더니 정말 부유방이 사라졌습니다 완전히 사라진건 아니지만 퍼정도는 없어진것 같아요 노력하면 된다는것을 알앗습니다 제이제이님 감사해용 
골반이 울퉁불퉁해요 푹 패인 엉덩이 솔루션 힙딥운동 힙딥없애기 HIPDIP,2323021,41000,1100,1231,2018.2.8,전 살이 하도 쪄서 팬티가 작아져서 조여진 자국인줄 힙딥이었군요 왜그러나 항상 거울보면서 고민이었는데 궁금한점 콕찝어주셔서 감사해요 힙딥 처음들어봤는데 빨리 고쳐야겠네요 오늘도 감사합니다 원인 어브덕션 원레그레이즈 벤트니사이드킥 자세고치기 선플 제안 다 좋아요 다만 근거없는 악플 성적조롱 비아냥은 모두 사전 통보없이 고소 또는 차단입니다 영구차단이기 때문에 채널에서 함께 소통할 수 없어요 살롱드핏 채널은 구독자와 소통하는 채널을 만들기 위한 클린댓글창 적극 추진합니다 저 알아냈어요 스쿼트 마지막자세에서 골반을 고정한 상태에서 윗엉덩이 두쪽을 서로 붙인다는 느낌으로 궁디에 힘주면 되네요 처음으로 스쿼트에 궁디자극을 느꼈어요 
골반 넓어지는 운동 홈트 ( hip wider exercises),2227060,43000,1000,1055,2017.6.20,운동법이나 보면될것을 피부화장을 어떻게 해라 눈썹안어울린다 라는 댓글은 왜다는지 본인들 화장이나 신경쓸것이지 나중에 볼 동영상에 추가를 하였지만 언제 할지는 미지수 트위스트 런지 양쪽 각 회 세트 원레그 데드리프트 양쪽 각 회 세트 사이드 레그레이즈 양쪽 각 회 세트 클럼쉘 양쪽 각 회 세트 브릿지 양쪽 각 회 세트 빈트니 사이드 킥백 양쪽 각 회 세트 운동 책갈피 입니다 앞의 유용한 원리 설명 영상 꼭 다 보시고 운동시 이용하시길 바랍니다 다들 화이팅 트위스트 런지 원레그 데드리프트 사이드 레그레이즈 클럼쉘 브릿지 어브덕터 벤트니 사이드 킥백 이몸매는 원피스 나미의몸매 실사판 현실몸매다요 얼마나 노력했을까요 부러우면서 그노력이 대단하시고 존경스럽네요 
튀어나온 앞벅지 없애는 방법 (허벅지살빼기 하체비만 다이어트),2169379,51000,662,1239,2018.5.8,바쁘신 분들을 위해 이 언니 완전 제대로 공부하신 분 개인 를 받아도 이렇게까지 설명해주시는 분 정말 없는 것 같아요 감사합니다 선플 제안 다 좋아요 다만 구독자들 사이 논란이 될 수 있는 댓글 악플 성희롱 등은 영구차단이기 때문에 향후 채널에서 함께 소통할 수 없어요 살롱드핏 채널은 구독자와 소통하는 채널을 만들기 위한 클린댓글창 적극 추진합니다 세상에 제이제이님 영상 몇개봤었는데 이영상은 처음부터 끝까지 공감했네요 코어근육때메 아랫배가 나오는 체형이랑 엉덩이와 허벅지의 경계가가 없고 처졌다는데 어쩜이렇게 잘아는가 싶엌네요 흑 과자 먹으면서 보고 있다가 깜놀 
ENG)하루의 전설 하체토닝 20분ver20min slim thigh workout,2136826,46000,198,5218,2020.3.24,누워서 보는 사람 손 한번 들어봐 고라니처럼 가련하게 길에서 쓰러지는게 꿈이신분들 도전하십시오 하 저 이거 하구 넘 힘들어서 바디워시로 머리감았어요 멘탈이 나갔나 걍 다리 해체토닝이다 이게 분 정규수업에서 덜어낸거라니도대체 정규수업에서 무슨 일이 일어나고 있는거예요 
